{
  "aadp_version": "1.0",
  "module": "aadp:relations",
  "module_version": "1.0",
  "kind": "relation-collection",
  "source": { "id": "character:alice", "type": "character" },
  "rel": "posts",
  "target_type": "post",
  "ordered": true,
  "generated_at": "2026-08-05T00:00:00Z",
  "checksum": "sha256:4f53cda18c2baa0c0354bb5f9a3ecbe5ed12ab4d8e11ba873c2f11161202b945",
  "items": [],
  "cursor": { "next": null }
}
